Slide number,Location: Lat,Location: Lon,Media: URL,Media: Caption,Media: Credit,Slide Title,Text. Note: You CAN use HTML tags here (50-60 words)
1,43.65281183,-79.38391475,TorontoSign.jpg,Toronto Sign in Nathan Phillips Square,Creative Commons,Toronto Sign,"Welcome to the walking tour of Toronto ! Today you will get a glimpse into some of Toronto's landmarks as well as find out your future go-to food and entertainment spots that will be your lifesavers during the school year. Currently, we are at Nathan Phillip's Square -- the heart of city life and venue for various events you have yet to experience. But for now, let's turn left on Queen Street to explore the biggest shopping centre of downtown Toronto -- Eaton Centre."
2,43.65442052,-79.38071544,,Eaton Centre,,Eaton Centre,"Right before the Queen Street-Yonge intersection, you can see an entrance to Eaton Centre to your left. This door will reveal an arcade of multi-story shops that can satisfy any need you migh have. At Eaton, you can buy books in Indigo, get coffee and food in the downstairs food hall, buy cosmetics and trinkets in Asian-themed stores and even get a mobile plan in the middle of the concourse. To stop you from the impulsive shopping, let's just walk through the first floor and exit Eaton Centre to explore our next location -- Yonge-Dundas Square."
3,43.65610183,-79.38034742,,Yonge and Dundas Square,,Yonge and Dundas Square,"Having exited the revolving doors at the northmost point of Eaton Centre, you enter Yonge-Dundas Square. With skyscrapers playing video advertisements all day long, this might be the perfect spot for the ""New York-like"" photos. Having said that, Dundas Square encapculates the worst and the best of downtown Toronto: at any time of the day you see homeless people, buskers and street preachers there. This place becomes the heart of Toronto life during celebrations and political protests, so if any of this is of interest to you, you might become a frequent visitor to Dundas Square. But for now, let's explore the public transit of downtown Toronto -- the TTC."
4,43.65625246,-79.38045439,,TTC,,Dundas to St Patrick TTC,"A flight of stairs will take you underground to Toronto's Subway -- TTC. Today, you will experience the idiosyncracy of Line 1, which makes a small u-shape through the downtown core. The subway goes quite slow so you do not have to shout to be heard by your friend. We will take a southbound train to St Patrick station where we will explore our last but not least location of the first part of the tour -- the food hall Village by the Grange."
5,43.65483699,-79.38835151,,TTC,,Dundas to St Patrick TTC,
6,43.65437969,-79.39048071,,The Grange,,Village by The Grange,"A vibrant collection of small eateries awaits you in this maze like food court. Every corner you turns seems to expose a new option for something to eat! Great for a quick bite while expolring the city. Located next to the Art Gallery of Ontario and the Ontario College of Art and Design, the food court is a hidden gem for students on a budget. Here, you can get delectable udon for less than $10 or a daily special bubble tea for up to $5. The food options do not end there -- the Grange also offers Middle Eastern cuisine, as well as European breakfasts and some renowned fast food options such as McDonald's or Popeyes. Either way, please take a bite of something before we continue our tour to another Toronto's neighbourhood -- Kensington market."
7,43.65337761,-79.40022919,Kensington Avenue.jpg,Kensington Avenue,,Kensington Market Neighbourhood,"Even though there isn't a specifc cutoff from Kensington market to the rest of downtown Toronto, you will know that you have arrived in the Kensington neighbourhoood as soon as you see the colourful shop-fronts and vibrant murals. With over 240 unique and eclectic businesses, ranging all the way from fresh produce to vintage items, there is no shortage of things for you to see!"
8,43.65465451,-79.40155125,Flamingo Vintage.jpg,Flamingo Vintage clothing store,,Flamingo Vintage ,"Thrifting is inexpensive and vintage clothes are all the trend at the moment - another reason why Kensington is so perfect for students on a budget. There are countless of vintage stores for you to explore, carrying almost anything you are looking for with affordable prices. If used items are not to your liking, no worries! You can find plenty of stores which sells brand new items, just walk around to discover whatever your heart desires!"
9,43.6544018,-79.40232589,Pancho y Emiliano.jpg,Pancho y Emiliano,,Pancho y Emiliano,
10,43.65578836,-79.40244092,Street market.jpg,Street markets,,Street markets,
11,43.66154651,-79.40908313,bampot house.mov,Bampot House,,Bampot House,"To get a sense of Harbord Village, go to Bampot House -- a community-oriented anti-cafe that where you can cowork, play board games, get crafty, do art therapy, talk philosophy and sing karaoke. In Bampot, you pay hourly for using the space, which also gains you access to unlimited tea and coffee!"
12,43.66195998,-79.40706628,emmer.mov,Emmer,,Emmer,"If you decide to go to Emmer, be ready to spend some time in a line – this is how good their pastry is. The highlight of the place is the pistachio and passion fruit croissants, with the first one getting sold out in the first working hour of the bakery."
13,43.66218175,-79.40622246,emissions record shop.mov,Emission Records and Major Treat,,Major Treat Coffee and Emission Records Shop,"Having bought the pastry, treat yourself to a tea or a coffee at the Major Treat Coffee and Emissions records shop. This place sells coffee, cookies, niche records and a variety of books, both fiction and non-fiction -- a great place for window-shopping and music conversations with the employees."
14,43.66223,-79.404227,kosower lane mirror .mov,Kosower Lane Hidden Gem,,Kosower Lane Mural and Mirror,"If you want to escape the hustle and bustle of Harbord Street, turn right to Major Street and then take the first turn left which will lead you in Kosower lane. Small and inconspicuous, Kosower lane can boast a fantastic mural and mirror art — a perfect spot for a selfie and contemplation."
15,43.66297006,-79.40335598,caversham bookstore.mov,Caversham Bookstore,,Caversham Bookstore,"The last stop in Harbord Village, a Caversham Bookstore is mental health specialized bookstore that offers I wide range of literature on various psychological, psychoanalytic and self-help topics. The selection of books at Caversham is pretty unique, and the staff can always recommend a read that should be most relevant to whatever you are going through right now."
16,43.66634842,-79.40613863,Pizzeria.MOV,Famoso Neopolitan Pizzeria,,Famoso Italian Pizzeria,"You must be hungry after visiting the bookstore, dine in at the Famoso italian pizzeria where you can get a margheritta pizza for $12. They also have other foods options such as salads, pastas! Food allergies? they have gluten free and vegan options too!"
17,43.66674441,-79.40569445,Fuwa Fuwa.jpg,Fuwa Fuwa Japanese Pancakes,,Fuwa Fuwa Dessert Cafe,"Dont forget about dessert! You have to try the pancakes at Fuwa Fuwa which is just a few shops down from Famoso. Their Tiramisu pancakes are a must try and you definitely have to add a hot drink on the side . They also have other desserts if you're not in the mood for pancakes such as cupcakes, cheesecakes, cookies and pudding. "
18,43.66598341,-79.40750968,Gift shop.jpg,Jux.ta.pose cards & gifts,,Jux.ta.pose cards & gifts,"Walk a few stores down and head on over to the giftshop and treat yourself or someone you love to something cute! they have so many fun quirky and unqiue knick knacks like birthday cards, candles, soaps, pins, home goods, keychains and various stationary. "
19,43.66547349,-79.40884596,PawPals.mp4,PawPalsYoga,,PawPalsYoga,Feeling stressed out from school or life? need some cuddles? Cross the street and visit PawPals! This is a cute activity you'd want to check out with a friend or alone. While relaxing your body through yogs you get a visit from some cute friendly faces that want all the hugs.
20,43.66546683,-79.40885907,Lee's Palace.jpg,Lee's Palace,,Lee's Palace Live Music Venue,Right up Bloor St. West and Albany is Lee's Palace! It's a classic and has been around since 1985. You should treat yourself to some live music at this rock concert hall. The ticket varies based on the specific event from anywhere between $15 to $40.
21,43.66907822,-79.40939177,Cathedral2.jpg,Cathedral of St.Alban-the-Martyr,,Cathedral of St.Alban-the-Martyr heritage building,The Cathedral of St.Alban-the-Martyr
22,43.66782608,-79.39374714,the ROM on film ver 1.jpg,Royal Ontario Museum,,Royal Ontario Museum,
